{
  "page": 6,
  "section": "PART H \u2014 Balance Sheet (Summary of Schedules)",
  "applicant": "Scott Weeden & Johnathan King",
  "as_of_date": "03/05/2026",
  "value_cell_x_inference": {
    "market_value_x": 233.67,
    "market_value_width": 72.29,
    "owed_x": 538.68,
    "owed_width": 39.55,
    "method": "Average of all \"$ Market Value\" and \"$ Owed\" header cell x-positions across all section headers on the page"
  },
  "cells": [
    {
      "text": "NOTE: PART MAY BE SUBSTITUTED. Applicant may submit alternative documents (<90 days old) that provide the information collected on this part. Check here if you are submitting alternative documents and proceed to Part I. Balance Sheet of: As of:",
      "row": 0,
      "col": 0,
      "coords": {
        "x": 14.416431486606598,
        "y": 50.90380147844554,
        "width": 579.5512642264366,
        "height": 32.84260636568069
      },
      "cell_type": "label",
      "answer": ""
    },
    {
      "text": "NOTE: PART MAY BE SUBSTITUTED. Applicant may submit alternative documents (<90 days old) that provide the information collected on this part. Check here if you are submitting alternative documents and proceed to Part I. Balance Sheet of: As of:",
      "row": 0,
      "col": 1,
      "coords": {
        "x": 14.416431486606598,
        "y": 50.90380147844554,
        "width": 579.5512642264366,
        "height": 32.84260636568069
      },
      "cell_type": "label",
      "answer": ""
    },
    {
      "text": "NOTE: PART MAY BE SUBSTITUTED. Applicant may submit alternative documents (<90 days old) that provide the information collected on this part. Check here if you are submitting alternative documents and proceed to Part I. Balance Sheet of: As of:",
      "row": 0,
      "col": 2,
      "coords": {
        "x": 14.416431486606598,
        "y": 50.90380147844554,
        "width": 579.5512642264366,
        "height": 32.84260636568069
      },
      "cell_type": "label",
      "answer": ""
    },
    {
      "text": "NOTE: PART MAY BE SUBSTITUTED. Applicant may submit alternative documents (<90 days old) that provide the information collected on this part. Check here if you are submitting alternative documents and proceed to Part I. Balance Sheet of: As of:",
      "row": 0,
      "col": 3,
      "coords": {
        "x": 14.416431486606598,
        "y": 50.90380147844554,
        "width": 579.5512642264366,
        "height": 32.84260636568069
      },
      "cell_type": "label",
      "answer": ""
    },
    {
      "text": "FARM",
      "row": 1,
      "col": 0,
      "coords": {
        "x": 16.789527267217636,
        "y": 95.75676716119051,
        "width": 323.7563286423683,
        "height": 13.805898271501064
      },
      "cell_type": "label",
      "answer": ""
    },
    {
      "text": "FARM",
      "row": 1,
      "col": 1,
      "coords": {
        "x": 16.789527267217636,
        "y": 95.75676716119051,
        "width": 323.7563286423683,
        "height": 13.805898271501064
      },
      "cell_type": "label",
      "answer": ""
    },
    {
      "text": "FARM",
      "row": 1,
      "col": 2,
      "coords": {
        "x": 16.789527267217636,
        "y": 95.75676716119051,
        "width": 323.7563286423683,
        "height": 13.805898271501064
      },
      "cell_type": "label",
      "answer": ""
    },
    {
      "text": "FARM",
      "row": 1,
      "col": 3,
      "coords": {
        "x": 16.789527267217636,
        "y": 95.75676716119051,
        "width": 323.7563286423683,
        "height": 13.805898271501064
      },
      "cell_type": "label",
      "answer": ""
    },
    {
      "text": "1A. Current Farm Assets",
      "row": 2,
      "col": 0,
      "coords": {
        "x": 16.874531999230385,
        "y": 110.54649268090725,
        "width": 106.85601250827312,
        "height": 11.910085022449493
      },
      "cell_type": "label",
      "answer": ""
    },
    {
      "text": "$ Market Value",
      "row": 2,
      "col": 1,
      "coords": {
        "x": 235.3774881362915,
        "y": 109.12361785769463,
        "width": 71.03627419471741,
        "height": 12.708936542272568
      },
      "cell_type": "label",
      "answer": ""
    },
    {
      "text": "1B. Current Farm Liabilities",
      "row": 2,
      "col": 2,
      "coords": {
        "x": 312.1738438606262,
        "y": 110.40203127264977,
        "width": 126.62629413604736,
        "height": 12.253347873687744
      },
      "cell_type": "label",
      "answer": ""
    },
    {
      "text": "$ Owed",
      "row": 2,
      "col": 3,
      "coords": {
        "x": 541.6236946582794,
        "y": 109.76527489721775,
        "width": 38.93148684501648,
        "height": 11.414414763450623
      },
      "cell_type": "label",
      "answer": ""
    },
    {
      "text": "Cash & Equivalents (Sch. A)",
      "row": 3,
      "col": 0,
      "coords": {
        "x": 16.918091595172882,
        "y": 124.11606913805008,
        "width": 106.5379090309143,
        "height": 12.06075069308281
      },
      "cell_type": "label",
      "answer": ""
    },
    {
      "row": 3,
      "col": "1_value",
      "cell_type": "value",
      "side": "assets",
      "label": "$ Market Value \u2014 Cash & Equivalents (Sch. A)",
      "answer": "$0.00",
      "coords": {
        "x": 233.67,
        "y": 123.91294039785862,
        "width": 72.29,
        "height": 11.8,
        "inferred": true
      }
    },
    {
      "text": "Accounts Payable ( Sch. AA)",
      "row": 3,
      "col": 2,
      "coords": {
        "x": 311.2318024635315,
        "y": 123.91294039785862,
        "width": 109.10606050491333,
        "height": 11.914953231811523
      },
      "cell_type": "label",
      "answer": ""
    },
    {
      "row": 3,
      "col": "3_value",
      "cell_type": "value",
      "side": "liabilities",
      "label": "$ Owed \u2014 Accounts Payable (Sch. AA)",
      "answer": "$0.00",
      "coords": {
        "x": 538.68,
        "y": 123.91294039785862,
        "width": 39.55,
        "height": 11.8,
        "inferred": true
      }
    },
    {
      "text": "Marketable Bonds & Securities",
      "row": 4,
      "col": 0,
      "coords": {
        "x": 16.862176835536957,
        "y": 138.7255275696516,
        "width": 125.34894505143166,
        "height": 12.168743804097176
      },
      "cell_type": "label",
      "answer": ""
    },
    {
      "row": 4,
      "col": "1_value",
      "cell_type": "value",
      "side": "assets",
      "label": "$ Market Value \u2014 Marketable Bonds & Securities",
      "answer": "$0.00",
      "coords": {
        "x": 233.67,
        "y": 138.22121353447437,
        "width": 72.29,
        "height": 11.8,
        "inferred": true
      }
    },
    {
      "text": "Income Taxes Payable",
      "row": 4,
      "col": 2,
      "coords": {
        "x": 312.0383117198944,
        "y": 138.22121353447437,
        "width": 103.87977027893066,
        "height": 11.675280466675758
      },
      "cell_type": "label",
      "answer": ""
    },
    {
      "row": 4,
      "col": "3_value",
      "cell_type": "value",
      "side": "liabilities",
      "label": "$ Owed \u2014 Income Taxes Payable",
      "answer": "$0.00",
      "coords": {
        "x": 538.68,
        "y": 138.22121353447437,
        "width": 39.55,
        "height": 11.8,
        "inferred": true
      }
    },
    {
      "text": "Accounts Receivable (Sch. B)",
      "row": 5,
      "col": 0,
      "coords": {
        "x": 16.88068589568138,
        "y": 152.40545010566711,
        "width": 117.60053053498268,
        "height": 11.945979952812195
      },
      "cell_type": "label",
      "answer": ""
    },
    {
      "row": 5,
      "col": "1_value",
      "cell_type": "value",
      "side": "assets",
      "label": "$ Market Value \u2014 Accounts Receivable (Sch. B)",
      "answer": "$0.00",
      "coords": {
        "x": 233.67,
        "y": 152.45591720938683,
        "width": 72.29,
        "height": 11.8,
        "inferred": true
      }
    },
    {
      "text": "Real Estate Taxes Payable",
      "row": 5,
      "col": 2,
      "coords": {
        "x": 312.89274299144745,
        "y": 152.45591720938683,
        "width": 111.30819940567017,
        "height": 11.497412323951721
      },
      "cell_type": "label",
      "answer": ""
    },
    {
      "row": 5,
      "col": "3_value",
      "cell_type": "value",
      "side": "liabilities",
      "label": "$ Owed \u2014 Real Estate Taxes Payable",
      "answer": "$0.00",
      "coords": {
        "x": 538.68,
        "y": 152.45591720938683,
        "width": 39.55,
        "height": 11.8,
        "inferred": true
      }
    },
    {
      "text": "Crop Inventory (Sch. C)",
      "row": 6,
      "col": 0,
      "coords": {
        "x": 16.957495480775833,
        "y": 166.97888919711113,
        "width": 88.87208342552185,
        "height": 11.765034019947052
      },
      "cell_type": "label",
      "answer": ""
    },
    {
      "row": 6,
      "col": "1_value",
      "cell_type": "value",
      "side": "assets",
      "label": "$ Market Value \u2014 Crop Inventory (Sch. C)",
      "answer": "$0.00",
      "coords": {
        "x": 233.67,
        "y": 166.70055744051933,
        "width": 72.29,
        "height": 11.8,
        "inferred": true
      }
    },
    {
      "text": "Notes Payable (12 months or less) (Sch. BB)",
      "row": 6,
      "col": 2,
      "coords": {
        "x": 311.9572129249573,
        "y": 166.70055744051933,
        "width": 177.1225242614746,
        "height": 11.604274928569794
      },
      "cell_type": "label",
      "answer": ""
    },
    {
      "row": 6,
      "col": "3_value",
      "cell_type": "value",
      "side": "liabilities",
      "label": "$ Owed \u2014 Notes Payable 12 months or less (Sch. BB)",
      "answer": "$0.00",
      "coords": {
        "x": 538.68,
        "y": 166.70055744051933,
        "width": 39.55,
        "height": 11.8,